name,description,lighting,watering,fertilizing,temperature,humidity,transplanting,soil_type,propagation,common_pests,toxicity_to_pets,blooming_season,pruning,special_care,diseases_description,diseases_prevention,diseases_treatment
алоэ вера,"Алоэ вера (Aloe vera) - это суккулентное растение с мясистыми, зубчатыми листьями, которые образуют розетку. Алоэ вера известно своими целебными свойствами и часто используется в косметике и медицине. Гель, извлекаемый из листьев, обладает увлажняющими и противовоспалительными свойствами, что делает его популярным средством для лечения ожогов и кожных заболеваний.","Алоэ вера предпочитает яркий солнечный свет. Лучшее место для него - это подоконники с южной или западной ориентацией. Недостаток света может привести к вытягиванию растения и уменьшению его декоративности.","Полив должен быть умеренным. Почва должна полностью просыхать между поливами, чтобы избежать переувлажнения. Зимой полив сокращают до минимума, так как растение находится в состоянии покоя и потребляет меньше влаги.","В период активного роста (весна-лето) рекомендуется подкармливать алоэ вера раз в месяц удобрением для кактусов и суккулентов. Это обеспечит растению необходимые питательные вещества для роста. Зимой подкормки не требуются, так как растение не активно растет.","Оптимальная температура для алоэ вера составляет 20-27°C. Растение не переносит заморозков и резких перепадов температур, поэтому его следует защищать от холодного воздуха.","Алоэ вера не требовательно к влажности воздуха. Оно хорошо себя чувствует в обычных условиях квартиры. Однако в сухом воздухе можно периодически опрыскивать листья для улучшения внешнего вида.","Пересаживают алоэ вера раз в 2-3 года по мере необходимости, когда корни заполняют горшок или почва теряет свои питательные свойства. Лучше всего пересаживать весной.","Для алоэ вера подходит рыхлый, хорошо дренированный субстрат для кактусов и суккулентов. Это обеспечит хорошую аэрацию корней и предотвратит застоя воды.","Размножение алоэ вера возможно детками (боковыми отростками) или семенами. Отростки следует отделять от материнского растения и укоренять в отдельном горшке. Семена можно высевать в легкий субстрат и поддерживать умеренную влажность до прорастания.","Среди распространенных вредителей можно выделить мучнистого червеца и щитовку, хотя они встречаются редко. Эти вредители могут ослабить растение и вызвать его увядание.","Алоэ вера токсично для кошек и собак при употреблении в больших количествах. Симптомы могут включать рвоту и диарею. Рекомендуется держать растение вдали от домашних животных.","Цветет алоэ вера редко, обычно в зимнее время при хороших условиях. Цветы представляют собой трубчатые соцветия, которые могут быть желтыми или оранжевыми.","Рекомендуется регулярно удалять сухие или поврежденные листья, чтобы поддерживать аккуратный внешний вид растения и предотвратить развитие заболеваний.","Специальный уход включает обеспечение хорошего освещения и умеренного полива. Важно также следить за состоянием корней и почвы, чтобы избежать переувлажнения.","Основные проблемы включают корневую гниль, которая возникает при переувлажнении почвы и недостаточной аэрации корней. Это может привести к увяданию растения и его гибели.","Для предотвращения заболеваний важно соблюдать правильный режим полива и обеспечить хорошую вентиляцию вокруг растения. Необходимо также избегать использования слишком тяжелых или плотных субстратов.","При обнаружении заболеваний необходимо удалить пораженные части растения и обработать его фунгицидами для предотвращения дальнейшего распространения инфекции."
кактус Эхинопсис,"Кактус Эхинопсис (Echinopsis cactus) - это род кактусов, который включает множество видов, отличающихся шаровидной или цилиндрической формой. Эти кактусы известны своими крупными, ароматными цветками, которые могут раскрывать свои лепестки на короткое время, но выглядят очень эффектно. Эхинопсисы неприхотливы в уходе и подходят для начинающих кактусистов.","Кактус Эхинопсис предпочитает яркий солнечный свет. Оптимально размещать его на южных или восточных окнах. Если света недостаточно, растение может вытягиваться и терять свою компактность.","Полив должен быть умеренным. Почва должна полностью просыхать между поливами, особенно в зимний период. Важно избегать застоя воды в поддоне и не допускать переувлажнения, так как это может привести к гниению корней.","В период активного роста (весна-лето) рекомендуется подкармливать кактус удобрением для кактусов и суккулентов раз в месяц. Зимой подкормки прекращают, так как растение находится в состоянии покоя.","Оптимальная температура для Эхинопсиса составляет 18-32°C. Зимой желательно обеспечить период покоя при температуре 10-15°C, чтобы растение смогло восстановиться перед новым вегетационным сезоном.","Кактус Эхинопсис не требователен к влажности воздуха. Он хорошо переносит сухие условия, но в очень сухом воздухе может возникнуть риск появления вредителей.","Пересаживают кактус раз в 2-3 года по мере необходимости, когда корни начинают заполнять горшок или когда почва теряет свои свойства. Пересадка лучше всего проводится весной.","Для Эхинопсиса подходит рыхлый, хорошо дренированный субстрат для кактусов и суккулентов. Можно использовать готовые смеси или самостоятельно приготовить, добавив песок и перлит для улучшения дренажа.","Размножение возможно детками, которые образуются на стебле, или семенами. Семена можно сеять весной в теплом и влажном месте для лучшего прорастания.","Среди распространенных вредителей можно выделить мучнистого червеца и паутинного клеща, особенно при слишком сухом воздухе. Регулярные осмотры помогут выявить проблемы на ранних стадиях.","Кактус Эхинопсис не токсичен для кошек и собак, однако колючки могут представлять опасность для домашних животных и детей.","Цветет весной или летом. Цветки крупные, воронковидные и могут быть белыми, розовыми или красными с приятным ароматом. Цветение может длиться всего несколько дней, но оно очень эффектное.","Рекомендуется удалять сухие или поврежденные колючки для поддержания здоровья растения и улучшения его внешнего вида.","Обеспечение периода покоя зимой важно для здоровья растения. Также необходимо следить за хорошим освещением в течение всего года.","Основные проблемы включают корневую гниль, которая может возникнуть при переувлажнении. Это заболевание проявляется потемнением и загниванием корней.","Для предотвращения заболеваний важно соблюдать правильный режим полива, избегать переувлажнения и обеспечивать хорошую вентиляцию вокруг растения.","При обнаружении пораженных частей растения необходимо удалить их и обработать фунгицидами для предотвращения дальнейшего распространения инфекции."
монстера деликатесная,"Монстера деликатесная (Monstera deliciosa) - это крупное тропическое растение из семейства ароидных, известное своими эффектными рассеченными листьями и способностью к ползучему росту. В естественной среде обитания оно может достигать значительных размеров, создавая густые заросли в тропических лесах. В домашних условиях, благодаря более ограниченному пространству, она растет более компактно, но все равно может достигать высоты до 2-3 метров.","Монстера предпочитает яркий рассеянный свет и может переносить полутень. Прямые солнечные лучи могут вызвать ожоги на листьях. При недостатке света листья становятся мельче и менее рассеченными, что влияет на декоративные качества растения.","Полив должен быть умеренным. Почва должна просыхать на 2-3 см вглубь между поливами. Важно избегать переувлажнения, особенно в зимний период, так как это может привести к гниению корней.","В период активного роста (весна-лето) рекомендуется подкармливать растение каждые 2-3 недели комплексным минеральным удобрением для декоративно-лиственных растений. Зимой подкормки следует прекратить или сократить до одного раза в 1,5-2 месяца, так как растение в этот период находится в состоянии покоя.","Оптимальная температура для монстеры составляет 20-25°C в период активного роста. В зимний период температура не должна опускаться ниже 16°C, так как это может негативно сказаться на здоровье растения.","Монстера предпочитает повышенную влажность воздуха (60-80%). Рекомендуется регулярно опрыскивать листья и протирать их от пыли, что также помогает предотвратить появление вредителей.","Молодые растения пересаживают ежегодно весной, когда они достигают размера горшка. Взрослые растения пересаживают раз в 2-3 года по мере необходимости или когда корни начинают выходить из дренажных отверстий горшка. При пересадке выбирайте горшок немного больше предыдущего.","Лучший субстрат для монстеры - рыхлый, питательный и хорошо дренированный. Рекомендуется использовать смесь торфа, перегноя, дерновой земли и песка в равных пропорциях для обеспечения хорошей аэрации корней.","Монстеру можно размножать несколькими способами: воздушными отводками, верхушечными черенками или делением корневища при пересадке. Черенки должны иметь несколько узлов и быть длиной не менее 15 см.","Среди распространенных вредителей можно выделить паутинного клеща, трипсов, щитовку и мучнистого червеца. Регулярный осмотр растений поможет выявить проблемы на ранних стадиях.","Монстера токсична для домашних животных (кошек и собак). Она содержит нерастворимые кристаллы оксалата кальция, которые могут вызывать раздражение слизистых оболочек при поедании листьев.","В комнатных условиях цветение монстеры происходит редко. При хорошем уходе и создании оптимальных условий растение может давать кремово-белые початки с приятным ароматом, которые появляются на длинных цветоносах.","Регулярно удаляйте сухие, поврежденные или пожелтевшие листья для улучшения внешнего вида растения и предотвращения распространения болезней. Также можно обрезать воздушные корни, если они мешают или выглядят неэстетично.","Монстера требует опоры для стебля (например, кокосовое волокно или мох), что позволяет ей развиваться естественным образом. Регулярное опрыскивание и протирание листьев от пыли также важны для здоровья растения.","Монстера может страдать от пятнистостей листьев, которые могут быть грибковыми или бактериальными. Признаки включают появление пятен на листьях разного цвета и размера, что может привести к их желтению и опадению.","Для предотвращения болезней соблюдайте правильный режим полива и влажности, регулярно осматривайте растения на наличие вредителей и обеспечивайте хорошую циркуляцию воздуха в помещении.","При обнаружении заболеваний удаляйте пораженные листья и обрабатывайте растение фунгицидами или бактерицидными препаратами в зависимости от типа заболевания."
орхидея Фаленопсис,"Орхидея Фаленопсис (Phalaenopsis orchid) - это одна из самых популярных комнатных орхидей благодаря своей элегантной форме и разнообразию расцветок. Цветы могут быть однотонными или с пятнами и полосами. Это растение требует определенного ухода, но при соблюдении условий радует длительным и обильным цветением, что делает его любимым выбором среди цветоводов.","Орхидея Фаленопсис предпочитает яркий рассеянный свет. Прямые солнечные лучи могут вызвать ожоги на листьях, поэтому лучше размещать ее в местах, где солнечные лучи будут мягкими. Оптимально размещать на восточных или западных окнах.","Полив должен быть умеренным. Рекомендуется поливать по мере просыхания субстрата. Один из лучших методов - погружение горшка в воду на 15-20 минут, чтобы корни могли впитать влагу. Важно избегать застоя воды в поддоне, так как это может привести к гниению корней.","В период активного роста и цветения (весна и лето) рекомендуется подкармливать орхидею специальным удобрением для орхидей каждые 2-3 недели. Зимой подкормки можно прекращать или сокращать до 1 раза в месяц, так как растение находится в состоянии покоя.","Оптимальная температура для орхидеи Фаленопсис составляет 18-27°C. Перепады ночных и дневных температур (примерно на 5°C) могут стимулировать цветение, поэтому полезно выносить растение на ночь в более прохладное место.","Орхидея предпочитает повышенную влажность воздуха (40-70%). Рекомендуется регулярно опрыскивать листья, а также размещать рядом с увлажнителем воздуха или использовать поддон с водой и камнями для повышения влажности.","Пересаживают орхидею раз в 2-3 года по мере необходимости, когда субстрат начинает разлагаться или корни заполняют горшок. При пересадке используют специальный субстрат для орхидей, который обеспечивает хорошую аэрацию корней.","Специальный субстрат для орхидей состоит из коры деревьев, мха сфагнума и древесного угля. Он обеспечивает необходимую аэрацию и дренаж, что важно для здоровья корней.","Размножение возможно детками (кейками), которые образуются на цветоносах после цветения. Также можно размножать орхидею делением куста при пересадке, если у растения несколько развитых корней.","Среди распространенных вредителей можно выделить мучнистого червеца, щитовку и паутинного клеща. Регулярные осмотры помогут выявить проблемы на ранних стадиях.","Орхидея Фаленопсис не токсична для кошек и собак, но может вызывать раздражение слизистых оболочек при попадании внутрь. Лучше держать растение вне досягаемости домашних животных.","Обычно цветет зимой или весной, но при хорошем уходе может цвести несколько раз в год. Цветение длится от нескольких недель до нескольких месяцев в зависимости от условий.","После цветения рекомендуется удалять отцветшие цветоносы, чтобы стимулировать рост новых побегов и улучшить внешний вид растения.","Орхидея требует регулярного опрыскивания для поддержания влажности. Также важно обеспечить хорошую вентиляцию вокруг растения и избегать попадания воды на цветы во время полива.","Основные проблемы включают корневую гниль (при переувлажнении) и бактериальные или грибковые пятнистости листьев. Эти заболевания могут возникнуть при неправильном уходе или недостаточной вентиляции.","Для предотвращения заболеваний важно соблюдать правильный режим полива и поддерживать нужный уровень влажности. Также следует обеспечить хорошую вентиляцию вокруг растения.","При обнаружении пораженных частей растения необходимо удалить их и обработать фунгицидом или бактерицидными препаратами для предотвращения дальнейшего распространения инфекции."
